{
  "$schema": "../../../schemas/documents/document.team_development_program-data-marketing-campaigns.schema.json",
  "schema_version": "1.0.0",
  "id": "document.team_development_program",
  "record_type": "document-section",
  "data": {
    "campaign_message": "Complex products. Whole teams. One development environment.",
    "campaign_promise": "Your team’s development environment should outlast any single computer architecture.",
    "claim_policy": "Robustness is a design goal demonstrated by recovery and reproducible builds, not an untested most-robust comparison. No write-once/run-anywhere or Apple/Commodore launch claim."
  }
}
